[
  {
    "id": "bow",
    "category": "weapon",
    "availability": [
      "NEXT",
      "LAUNCH",
      "EXPANSION"
    ],
    "name_key": "WEAPON_BOW_NAME",
    "description_key": "WEAPON_BOW_DESC",
    "tags": [
      "charge",
      "precision",
      "ranged"
    ],
    "references": [
      "bow_candidate_v1",
      "bow_launch_v1"
    ],
    "compatibility": {},
    "effects": {}
  },
  {
    "id": "gauntlets",
    "category": "weapon",
    "availability": [
      "LAUNCH",
      "EXPANSION"
    ],
    "name_key": "WEAPON_GAUNTLETS_NAME",
    "description_key": "WEAPON_GAUNTLETS_DESC",
    "tags": [
      "close_pressure",
      "combo",
      "melee"
    ],
    "references": [
      "gauntlets_launch_v1"
    ],
    "compatibility": {},
    "effects": {}
  },
  {
    "id": "gun",
    "category": "weapon",
    "availability": [
      "LAUNCH",
      "EXPANSION"
    ],
    "name_key": "WEAPON_GUN_NAME",
    "description_key": "WEAPON_GUN_DESC",
    "tags": [
      "ammunition",
      "burst_cycle",
      "reload"
    ],
    "references": [
      "gun_launch_v1"
    ],
    "compatibility": {},
    "effects": {}
  },
  {
    "id": "staff",
    "category": "weapon",
    "availability": [
      "LAUNCH",
      "EXPANSION"
    ],
    "name_key": "WEAPON_STAFF_NAME",
    "description_key": "WEAPON_STAFF_DESC",
    "tags": [
      "area_control",
      "ranged",
      "spell_sequence"
    ],
    "references": [
      "staff_launch_v1"
    ],
    "compatibility": {},
    "effects": {}
  },
  {
    "id": "sword",
    "category": "weapon",
    "availability": [
      "M1",
      "CURRENT",
      "NEXT",
      "LAUNCH",
      "EXPANSION"
    ],
    "name_key": "WEAPON_SWORD_NAME",
    "description_key": "WEAPON_SWORD_DESC",
    "tags": [
      "counter_window",
      "melee",
      "short_commitment"
    ],
    "references": [
      "sword_launch_v1",
      "sword_m1_v1"
    ],
    "compatibility": {},
    "effects": {}
  }
]
