[
  {
    "id": "primordial_knight",
    "category": "character",
    "availability": [
      "LAUNCH",
      "EXPANSION"
    ],
    "name_key": "CHARACTER_PRIMORDIAL_KNIGHT_NAME",
    "description_key": "CHARACTER_PRIMORDIAL_KNIGHT_DESC",
    "tags": [
      "armor_window",
      "deliberate_burst",
      "heavy_commitment"
    ],
    "references": [
      "primordial_knight_launch_v1"
    ],
    "compatibility": {},
    "effects": {}
  },
  {
    "id": "time_guardian",
    "category": "character",
    "availability": [
      "LAUNCH",
      "EXPANSION"
    ],
    "name_key": "CHARACTER_TIME_GUARDIAN_NAME",
    "description_key": "CHARACTER_TIME_GUARDIAN_DESC",
    "tags": [
      "cooldown_control",
      "defensive_timing",
      "perfect_guard"
    ],
    "references": [
      "time_guardian_launch_v1"
    ],
    "compatibility": {},
    "effects": {}
  },
  {
    "id": "time_lord",
    "category": "character",
    "availability": [
      "LAUNCH",
      "EXPANSION"
    ],
    "name_key": "CHARACTER_TIME_LORD_NAME",
    "description_key": "CHARACTER_TIME_LORD_DESC",
    "tags": [
      "multi_ability",
      "time_resource",
      "timing_complexity"
    ],
    "references": [
      "time_lord_launch_v1"
    ],
    "compatibility": {},
    "effects": {}
  },
  {
    "id": "void_walker",
    "category": "character",
    "availability": [
      "LAUNCH",
      "EXPANSION"
    ],
    "name_key": "CHARACTER_VOID_WALKER_NAME",
    "description_key": "CHARACTER_VOID_WALKER_DESC",
    "tags": [
      "low_hp_void",
      "spatial_risk",
      "void"
    ],
    "references": [
      "void_walker_launch_v1"
    ],
    "compatibility": {},
    "effects": {}
  },
  {
    "id": "wanderer",
    "category": "character",
    "availability": [
      "M1",
      "CURRENT",
      "NEXT",
      "LAUNCH",
      "EXPANSION"
    ],
    "name_key": "CHARACTER_WANDERER_NAME",
    "description_key": "CHARACTER_WANDERER_DESC",
    "tags": [
      "balanced",
      "baseline",
      "timing"
    ],
    "references": [
      "wanderer_launch_v1",
      "wanderer_m1_v1"
    ],
    "compatibility": {},
    "effects": {}
  }
]
